{
  "id": "io-europe-map-01",
  "title": "Europe Physical Map Occlusion",
  "subject": "Map",
  "chapter": "Europe",
  "cards": [
    {
      "id": "card-europe-01",
      "source": {
        "chapter": "Europe",
        "evidence_ids": [
          "ev-europe-01"
        ]
      },
      "asset": {
        "path": "media/europe_map.svg",
        "width": 800,
        "height": 600,
        "source_type": "source_provided",
        "sha256": "37a57b724ed26bfc6b05bdee552e98cb96a2e168e24f32ed2e139e3eb0211451"
      },
      "mode": "hide_all_guess_one",
      "regions": [
        {
          "id": "reg-01",
          "shape": "rectangle",
          "coordinates": [
            16.5,
            64,
            11.5,
            7
          ],
          "label": "पाइरेनीज़ पर्वत (Pyrenees)",
          "answer": "पाइरेनीज़ पर्वत (फ्रांस-स्पेन सीमा)"
        },
        {
          "id": "reg-02",
          "shape": "rectangle",
          "coordinates": [
            32.5,
            57,
            15,
            7.5
          ],
          "label": "आल्प्स पर्वतमाला (Alps)",
          "answer": "आल्प्स पर्वतमाला (मोंट ब्लांक)"
        },
        {
          "id": "reg-03",
          "shape": "rectangle",
          "coordinates": [
            76,
            15,
            9,
            44
          ],
          "label": "यूराल पर्वत (Ural Mountains)",
          "answer": "यूराल पर्वत (यूरोप-एशिया सीमा)"
        },
        {
          "id": "reg-04",
          "shape": "rectangle",
          "coordinates": [
            76.5,
            68,
            12,
            9.5
          ],
          "label": "काकेशस पर्वत (Caucasus)",
          "answer": "काकेशस पर्वत (माउंट एल्ब्रुस)"
        },
        {
          "id": "reg-05",
          "shape": "rectangle",
          "coordinates": [
            51,
            53,
            11,
            11
          ],
          "label": "कार्पेथियन पर्वत (Carpathians)",
          "answer": "कार्पेथियन पर्वत (मध्य यूरोप)"
        },
        {
          "id": "reg-06",
          "shape": "rectangle",
          "coordinates": [
            38.5,
            56.5,
            25,
            12
          ],
          "label": "डेन्यूब नदी (Danube River)",
          "answer": "डेन्यूब नदी (10 देशों से बहने वाली)"
        },
        {
          "id": "reg-07",
          "shape": "rectangle",
          "coordinates": [
            69,
            32,
            19.5,
            34
          ],
          "label": "वोल्गा नदी (Volga River)",
          "answer": "वोल्गा नदी (यूरोप की सबसे लंबी नदी)"
        },
        {
          "id": "reg-08",
          "shape": "rectangle",
          "coordinates": [
            26.5,
            45,
            11,
            16
          ],
          "label": "राइन नदी (Rhine River)",
          "answer": "राइन नदी (व्यस्ततम जलमार्ग)"
        },
        {
          "id": "reg-09",
          "shape": "rectangle",
          "coordinates": [
            34,
            8,
            20,
            28
          ],
          "label": "स्कैंडिनेवियाई प्रायद्वीप",
          "answer": "स्कैंडिनेवियाई प्रायद्वीप (नॉर्वे-स्वीडन)"
        },
        {
          "id": "reg-10",
          "shape": "rectangle",
          "coordinates": [
            8.5,
            67,
            19,
            16
          ],
          "label": "आइबेरियन प्रायद्वीप",
          "answer": "आइबेरियन प्रायद्वीप (स्पेन-पुर्तगाल)"
        },
        {
          "id": "reg-11",
          "shape": "rectangle",
          "coordinates": [
            40,
            70,
            9.5,
            16
          ],
          "label": "एपेनाइन प्रायद्वीप",
          "answer": "एपेनाइन प्रायद्वीप (इटली)"
        },
        {
          "id": "reg-12",
          "shape": "rectangle",
          "coordinates": [
            51.5,
            68,
            17.5,
            14
          ],
          "label": "बाल्कन प्रायद्वीप",
          "answer": "बाल्कन प्रायद्वीप (दक्षिण-पूर्वी यूरोप)"
        },
        {
          "id": "reg-13",
          "shape": "rectangle",
          "coordinates": [
            7.5,
            79,
            8,
            7
          ],
          "label": "जिब्राल्टर जलसंधि",
          "answer": "जिब्राल्टर जलसंधि (भूमध्य सागर की कुंजी)"
        },
        {
          "id": "reg-14",
          "shape": "rectangle",
          "coordinates": [
            20,
            47,
            9,
            7.5
          ],
          "label": "डोवर जलसंधि / इंग्लिश चैनल",
          "answer": "डोवर जलसंधि (ब्रिटेन-फ्रांस)"
        },
        {
          "id": "reg-15",
          "shape": "rectangle",
          "coordinates": [
            67,
            72,
            8,
            7.5
          ],
          "label": "बोस्पोरस जलसंधि",
          "answer": "बोस्पोरस जलसंधि (काला सागर-मरमरा सागर)"
        }
      ]
    }
  ]
}